symbol,datetime,headline,summary,source,category,url,related
AAPL,2026-04-13 17:27:00,The Rumor Propelling Dell Stock Higher,An unsourced report from a technology news site claims Nvidia has been in talks to buy a large PC company.,Yahoo,company,https://finnhub.io/api/news?id=9ec5faf4381a4d6a7cfef59495debc316e6d2474e96800b40a6258d30bc5279d,AAPL
AAPL,2026-04-13 17:47:06,'Boy Who Cried Wolf': David Sacks Questions Whether Anthropic's Mythos Scare Is Just A Sales Pitch,"David Sacks accuses Anthropic of using fear to market Mythos, but admits the cybersecurity threat may be real.",Benzinga,company,https://finnhub.io/api/news?id=015d8a02ad07f65cb4d5ad6e953ee9bc0bd8dafd817110381415cf65a11d73b8,AAPL
AAPL,2026-04-13 18:20:00,"The More Artificial Intelligence (AI) Models That Come Out, the More I'm Convinced Apple Has the Right Strategy",Apple could save a ton of money by simply being patient.,Yahoo,company,https://finnhub.io/api/news?id=74bb9334bebeb80fb866b8398b517b7e84deb5601aafb1c1b488c09576b4d4be,AAPL
AAPL,2026-04-13 18:33:45,Why Millions of Investors Are Buying the Wrong NASDAQ ETF,"Most investors seeking Nasdaq exposure reach for QQQ without hesitation. It’s the most traded ETF in the world, liquid, and synonymous with tech growth. The problem is that QQQ tracks the Nasdaq-100, which holds only the 100 largest non-financial companies on the exchange. That’s a narrow slice of a market with thousands of listed companies, ... Why Millions of Investors Are Buying the Wrong NASDAQ ETF",Yahoo,company,https://finnhub.io/api/news?id=1efc3694de6aa44ea52bb1e8e848f0489e01d24cd28155894450af8bc3928b4a,AAPL
AAPL,2026-04-13 19:22:48,4 ETFs That Mirror Warren Buffett’s Buy-and-Hold Strategy in 2026,"Warren Buffett built his fortune by buying businesses with durable competitive advantages at reasonable prices and holding them for decades. A handful of ETFs are built around the core mechanics of how Buffett actually invests, whether through Morningstar’s moat framework, free cash flow screening, or direct exposure to Berkshire Hathaway’s portfolio itself. A handful of ... 4 ETFs That Mirror Warren Buffett’s Buy-and-Hold Strategy in 2026",Yahoo,company,https://finnhub.io/api/news?id=67a5d5d0510a2c608414428262d16e97fc92a9c39b02c04939a7ee9a99007342,AAPL
AAPL,2026-04-13 19:42:26,"Amazon stock leads 9-day Mag 7 performance, Tesla falls behind","Yahoo Finance Markets and Data Editor Jared Blikre takes a look at megacaps' recent stock performance, including Big Tech names like Amazon (AMZN), Broadcom (AVGO), and Tesla (TSLA).",Yahoo,company,https://finnhub.io/api/news?id=a81d7989d4b525024b5b708a97412dab9f7f00df239121105b6faa10ec164d2b,AAPL
AAPL,2026-04-13 20:30:48,"Energy and International ETFs Offer the Diversification Your $1,000 Deserves in 2026","With the VIX sitting near 19 after a sharp pullback from a March spike above 31, and the Fed holding rates steady at 3.75% after cutting 75 basis points over the prior year, the equity market backdrop in April 2026 sits in ambiguous territory. That makes the question of where to put $1,000 more interesting ... Energy and International ETFs Offer the Diversification Your $1,000 Deserves in 2026",Yahoo,company,https://finnhub.io/api/news?id=7481df2eeae82fff225e50a6c999cf4eec0b228fa3866ed7b9ad28b8d50e4416,AAPL
AAPL,2026-04-13 20:40:45,Trump threatens to destroy any Iranian ships near US blockade at Strait of Hormuz,President Trump threatened to destroy Iranian ships that impede a US blockade on the Strait of Hormuz.,Yahoo,company,https://finnhub.io/api/news?id=41bddf710e1499aea651a45f7bad43d225c2fbfb807df672fa8d1c1c22affa0c,AAPL
AAPL,2026-04-13 21:35:50,CNBC Daily Open: Markets bet on a U.S.-Iran deal amid Hormuz blockade,"The U.S. blockade in the Strait of Hormuz risks deepening the energy shock, but markets are  shrugging it off amid optimism for a deal. ",CNBC,company,https://finnhub.io/api/news?id=6fb31cbd5ca401030730f203011bba237c04751c538467c43b041e189f393973,AAPL
AAPL,2026-04-13 23:00:00,Music superstar loses retirement fund to fake app,"American singer Garrett Dutton, or ""G. Love,"" who is best known as the frontman for the band G. Love & Special Sauce, disclosed on X on Apr. 11 that he lost his retirement fund in Bitcoin (BTC) after downloading a malicious app resembling the Ledger wallet app from Apple's App ...",Yahoo,company,https://finnhub.io/api/news?id=ac3df866344cfe87f8eb48a1eea81be64e27a20112ece5fd6ccfdc134fbd2f33,AAPL
AAPL,2026-04-13 23:35:26,"Nvidia Denies Rumors About Acquiring PC Maker; HP, Dell Stocks Still Spike Over 5% — Analyst Says Rivals May Eye Deal Instead (UPDATED)","Nvidia denied reports of acquiring a PC maker, but shares of Dell and HP still surged as analysts said rivals like AMD more likely buyers.",Benzinga,company,https://finnhub.io/api/news?id=06959b889606983820340681030478282dbac013c4043004dba60e3f34499074,AAPL
AAPL,2026-04-13 23:52:00,Omdia: China Smartphone Shipments Fell 1% in First Quarter of 2026 as Rising Costs Pushed Up Device Prices,"LONDON, April 13, 2026--According to Omdia’s latest research, Mainland China’s smartphone market declined by 1% year on year in 1Q 2026, with shipments reaching 69.8 million units. In 1Q 2026, rising component costs, particularly for memory, prompted major vendors to increase product prices, further extending the market’s downward trajectory. Huawei ranked first with shipments of 13.9 million units, capturing a 20% market share and maintaining strong momentum. Apple followed in second place with",Yahoo,company,https://finnhub.io/api/news?id=84631db0c0168661a7508c370603f395ae0d2dbcbb8a992fb026d7bfbe5c1bd1,AAPL
AAPL,2026-04-14 01:35:45,"CNBC Daily Open: S&P stages a comeback, erasing all Iran war losses","U.S. stocks rally to erase Iran war losses as Vice President Vance says ""ball is in Iran's court.""",CNBC,company,https://finnhub.io/api/news?id=f62f18def8c80a7aec81ebb2e8f9813d68f43994596b9674a7802af39417ba20,AAPL
AAPL,2026-04-14 02:31:04,Amazon Nears Deal for Globalstar in Push to Rival Musk’s Starlink,"(Bloomberg) -- Amazon.com Inc. is in advanced talks to acquire satellite operator Globalstar Inc. in a deal that would boost the tech giant’s efforts to build its own satellite operation, according to people familiar with the matter.A transaction could be announced as soon as Tuesday, said the people, who asked not to be identified because the information was private.A final agreement hasn’t been reached and talks might still end without one, or the timing could change, the people said. A repres",Yahoo,company,https://finnhub.io/api/news?id=7501a76bd01776d6dfef32e201f55281eab1a1bdd4c5d8b1196d84d72a26200c,AAPL
AAPL,2026-04-14 02:35:32,"Community Trust Adds 122,541 Shares of CTBI","Community Trust Bancorp delivers regional banking and wealth management services across Kentucky, West Virginia, and Tennessee.",Yahoo,company,https://finnhub.io/api/news?id=e75b904836b79de866453207d5dd90acbc6425c94cae17cf8b7766562c8c3f6e,AAPL
AAPL,2026-04-14 04:51:09,Hills Mac Repair Opens MacBook & iMac Repair Workshop For Sydney's Hills District,"Local Apple computer repair specialist Hills Mac Repair has now opened its doors to a new dedicated workshop within Sydney's Hills District, bringing professional MacBook and iMac repair services to...",Finnhub,company,https://finnhub.io/api/news?id=7d9d5cceb8329dde09353ceba1bb2f48a23436398fa0d7f315b7b7a4b4957f5f,AAPL
AAPL,2026-04-14 05:42:57,"Apple's Foldable iPhone Is Coming for Everyone — Samsung, Motorola, Google Beware!",Samsung and Google face pressure as Apple prepares to enter the foldable market. Analysts see AAPL capturing 46% of the segment by 2026.,Benzinga,company,https://finnhub.io/api/news?id=c08c649147a9cbbef9b1936c53db60359c1fcdf154fc2ee12d24662fe010d405,AAPL
AAPL,2026-04-14 06:33:49,"B of A Securities Maintains Buy on Apple, Raises Price Target to $325",B of A Securities  analyst Wamsi Mohan   maintains Apple (NASDAQ:AAPL) with a Buy and raises the price target from $320 to $325.,Benzinga,company,https://finnhub.io/api/news?id=fdd592102ac52a501255d76e9c4faeff054aae41505222b228bd04bbb3f3a124,AAPL
AAPL,2026-04-14 07:54:51,Apple To Rally More Than 25%? Here Are 10 Top Analyst Forecasts For Tuesday,"Top Wall Street analysts have changed their outlook on top names. For full analyst rating changes, including upgrades/downgrades, see analyst ratings page.",Benzinga,company,https://finnhub.io/api/news?id=0ff23aaaf57a4fe13af20466949db691b86baa89358acd2751ea73fb2dc9c891,AAPL
AAPL,2026-04-14 08:08:36,"Amazon To Acquire Globalstar For $90 Per Share In Cash Or Stock, And Announces That Amazon Leo Will Power Satellite Services for Apple Watch and iPhone","Amazon will acquire Globalstar, enabling Amazon Leo to add direct-to-device (D2D) services to its low Earth orbit satellite network and extend cellular coverage to customers beyond the reach of terrestrial networks. In addition, Amazon and Apple announced an agreement for Amazon Leo to power satellite services for iPhone and Apple Watch1, including Emergency SOS via satellite.",Benzinga,company,https://finnhub.io/api/news?id=99933f796130c74ab1e2c54f027bfd3b8a76b75246e9f51195b91542bbf47d5a,AAPL
AAPL,2026-04-14 08:19:40,Amazon to buy Globalstar to bolster Leo satellite business in deal worth about $11.6 billion,"Amazon said it would acquire Globalstar, giving its nascent satellite internet business a boost as it vies to compete with Elon Musk's SpaceX. ",CNBC,company,https://finnhub.io/api/news?id=eb1fd7dec54e36520b91880f1aba09f84507950a9451883e3ffcf1945f4b59bf,AAPL
AAPL,2026-04-14 08:26:00,"2 ""Magnificent Seven"" Stocks That Can Skyrocket 96% and 107%, According to Select Wall Street Analysts","Among Nvidia, Alphabet, Apple, Microsoft, Amazon, Meta Platforms, and Tesla are two highly influential businesses that some of Wall Street's leading optimists believe can effectively double.",Yahoo,company,https://finnhub.io/api/news?id=39398334d3e2105d29f80d01d96644248763e76d19c33e6fa80efc390ac1011a,AAPL
AAPL,2026-04-14 08:55:01,Zillow CEO didn’t find success by chasing a linear career path: It was more like a 'jungle gym',"Zillow CEO Jeremy Wacksman says successful careers aren't typically the result of a linear path. The journey is more like a jungle gym, he says. ",CNBC,company,https://finnhub.io/api/news?id=a5aef61998ff2d6fbcb8317cb70ebfe3f4e04d8e37b1f8bb96f47dedbab08722,AAPL
AAPL,2026-04-14 09:26:00,One of Greg Abel's Forever Holdings at Berkshire Hathaway Is Breaking Warren Buffett's Most Important Investing Rule,The Oracle of Omaha was always unwavering when it came to value and getting a good deal.,Yahoo,company,https://finnhub.io/api/news?id=9853763e74dccbb7baa835ab6569dde9d7a76eae7c062f148dcf9dd08a825685,AAPL
AAPL,2026-04-14 09:45:00,"The Zacks Analyst Blog Highlights Netflix, Apple, Amazon and Disney","Netflix heads into Q1 earnings with 15% revenue growth outlook, rising ad sales, and new content deals boosting engagement and margin expansion.",Yahoo,company,https://finnhub.io/api/news?id=0a84cc8a9a995ccc42d85056d1d04ba5dc9480d5d17fa991d9b3ab8bec85d668,AAPL
AAPL,2026-04-14 09:47:54,Why Apple Still Wins Here,"Apple enters Q2 FY2026 with $109.2B revenue expectations and $1.94 EPS, supported by 27 upward estimate revisions across metrics.",SeekingAlpha,company,https://finnhub.io/api/news?id=2401df6b0d29c09b52617261b7b09d266cda735bcc519aaad0484d0d1ac43208,AAPL
AAPL,2026-04-14 10:01:05,Why Is Xiao-I Stock Sinking On Tuesday?,AIXI stock is trading lower Tuesday. Learn why Xiao-I Corp is facing a pullback after its historic patent win against Apple.,Benzinga,company,https://finnhub.io/api/news?id=8484996fc14402c9cf51bcbc4695ee9bdf5e4586f0e6633b2cf117bcdd04d573,AAPL
AAPL,2026-04-14 10:30:00,Amazon 'snaps at Starlink's heels' with acquisition of Globalstar,"Amazon.com Inc (NASDAQ:AMZN) has agreed to acquire Globalstar Inc (NASDAQ:GSAT) in a deal aimed at expanding its satellite telecommunications connectivity, including powering emergency features on Apple Inc (NASDAQ:AAPL) iPhones and Apple Watches. The acquisition will allow Amazon’s low Earth...",Yahoo,company,https://finnhub.io/api/news?id=e3acaa2baa6395e5b901445c43fd153e712f7e2a642fc8b27fa29121a3f5d491,AAPL
AAPL,2026-04-14 10:32:00,"Globalstar Stock Surges. It’s Nearing a Takeover by Amazon, Report Says.",Globalstar stock was leaping on Tuesday following a report that Amazon.com is nearing a deal for the satellite company.,Yahoo,company,https://finnhub.io/api/news?id=1f52ea080e54b72b9600e10a99af25002b7b8a2791cb24fd834c76c6e02cec1e,AAPL
AAPL,2026-04-14 10:59:33,Trump Comment Triggers Massive Short Squeeze - Market Deep Into Resistance Zone; JPMorgan Warns Of Risks,"



Massive Short Squeeze


",Benzinga,company,https://finnhub.io/api/news?id=a381466c4cf071774b88c5ef2750b85f04c81f47cfeb1ea663e6a7dc6c1c951a,AAPL
AAPL,2026-04-14 11:00:00,"RWS Global, A World Leader in Live Entertainment and Sports, Announces Executive Leadership Transition","RWS Global, a world leader in live experiences across entertainment and sports, today announced that Founder, Chairman & CEO Ryan Stana will transition to Executive Chairman. Current Chief Operating Officer Jake McCoy has been appointed Interim CEO. The transition was announced by Stana with the support of Bluestone Equity Partners, RWS Global's minority investor, as well as the company's Board of Directors.",Yahoo,company,https://finnhub.io/api/news?id=163a329abe7913ffbf18d2571f10250d9523a05f96d225fa681ddd916c57b316,AAPL
AAPL,2026-04-14 11:33:54,ASML investors bet on 'picks and shovels' of AI revolution,"Shares in the Netherlands-based company have risen more than 40% so far this year, lifted ‌by the rapid construction of data centres and booming demand for cutting-edge chips from customers such as Nvidia, which rely on ASML's tools.  ASML supplies lithography machines to chipmakers ​including Taiwan's TSMC, which manufactures processors for Nvidia and Apple.  Analysts expect ‌a strong quarter and see scope for ASML ⁠to raise its 2026 sales outlook, as memory-chip makers expand capacity to meet AI-driven demand.",Yahoo,company,https://finnhub.io/api/news?id=0d7e1b83604dbcb0c2799be6c2840d665469344f329c7ea964080e84fc04d52d,AAPL
AAPL,2026-04-14 12:19:00,Globalstar Agrees to Amazon Takeover. The Satellite Stock Jumps. The Impact on AST SpaceMobile and Iridium.,Globalstar  stock was jumping on Tuesday as  Amazon.com  is buying the satellite company.  Amazon said it will buy Globalstar for the equivalent of $90 a share.  Globalstar shares were up 9.1% at $79.50 in premarket trading.,Yahoo,company,https://finnhub.io/api/news?id=ecaa7ed1dbdd34b98609878423fa2682d192de11157126ffd0112d9bc692e172,AAPL
AAPL,2026-04-14 12:44:53,Why AI Disruption Is a Short Seller’s Best Friend — Muddy Waters Founder Sees Profits in Market Turmoil,"Famed short seller Carson Block, founder of Muddy Waters Research, says artificial intelligence (AI) is creating a golden era for short sellers. In a recent interview with the Financial Times, Block argued that AI could trigger a market shake-up bigger than the 2008–09 global financial crisis, opening fresh opportunities for short sellers after years of limited profits. For context, short selling is a trading strategy where an investor bets that a stock’s price will fall. If the stock price goes",Yahoo,company,https://finnhub.io/api/news?id=27547103479545d17a32e817434684b7c6c2e4e02979ceca3ec5fb449aa1322e,AAPL
AAPL,2026-04-14 12:46:03,Warning: “Existential Risk” as Mega IPOs Could Trigger $100 Billion Stock Selloff,"If passive fund mechanics are your jam, and mega-cap concentration risk is the bread you eat it on, what Steve Sosnik laid out recently on The Compound and Friends is one of the more unsettling structural meals you’ll ever eat. The episode “Stocks Took the Stairs Down and the Elevator Up,” frames something most retail ... Warning: “Existential Risk” as Mega IPOs Could Trigger $100 Billion Stock Selloff",Yahoo,company,https://finnhub.io/api/news?id=9a0a8aff7dbc8fae78a42b075bdccb65348b0ea3a9dcc56c24454ccd16c03957,AAPL
AAPL,2026-04-14 13:00:03,Here is What to Know Beyond Why Apple Inc. (AAPL) is a Trending Stock,"Recently, Zacks.com users have been paying close attention to Apple (AAPL). This makes it worthwhile to examine what the stock has in store.",Yahoo,company,https://finnhub.io/api/news?id=578ff64554f32b45e2b9a09257cdf0430b1c852c3797f6dbc683f1c6a68abf81,AAPL
AAPL,2026-04-14 13:03:39,"Stocks Rally Toward Record Highs, Oil Crashes 7% As Iran Talks Show Progress: What's Moving Markets Tuesday?",U.S. equities rally to pre-war highs and crude plunges nearly 7% as U.S. Vice President JD Vance cites &#34;a lot of progress&#34; in Iran talks.,Benzinga,company,https://finnhub.io/api/news?id=2ea443a3d02072aa19c78a0b0a6229aa3977d2dff5d09f1d0e34bdb88570264a,AAPL
AAPL,2026-04-14 13:20:00,"Meet the Super Semiconductor Stock Crushing Nvidia, AMD, and Broadcom Right Now",This company is leveraging 175 years of experience to capture a key piece of the artificial intelligence (AI) market.,Yahoo,company,https://finnhub.io/api/news?id=a31b427f58d0396f8570039c89b0870bf2a6b6b7b0b399368deb8cedfcb599df,AAPL
AAPL,2026-04-14 13:22:01,Amazon Agrees To Buy Globalstar In $11.6 Billion Deal Amid Musk Space Battle,"Amazon agreed to buy Globalstar for $11.57 billion, in a move expanding its satellite business versus Elon Musk-controlled companies.",Yahoo,company,https://finnhub.io/api/news?id=17404504f2568580568ffc36f6b3b49d69ca0d3fa9b1d2333c956692a7acd889,AAPL
AAPL,2026-04-14 13:53:11,Apple Gets a Price Target Boost From BofA: Is a Big iPhone and Services Beat Coming?,"Apple (NASDAQ:AAPL) stock is getting an upvote on Wall Street ahead of a closely watched earnings report. Bank of America raised its price target on AAPL stock to $325 from $320 while maintaining a Buy rating, citing continued momentum in iPhone sales and Services revenue growth. The revision comes ahead of fiscal Q2 earnings due ... Apple Gets a Price Target Boost From BofA: Is a Big iPhone and Services Beat Coming?",Yahoo,company,https://finnhub.io/api/news?id=619cf8a4081dbe2e060aebbbc7bf1c82cb83aecbaf9266b167e9bb0ff8eb0269,AAPL
AAPL,2026-04-14 13:55:42,Amazon to buy Globalstar for $11.57B in bid to flesh out its satellite biz,"Amazon on Tuesday agreed to buy satellite company Globalstar, known for powering Apple's ""Emergency SOS"" feature, for $11.57 billion in cash.",Yahoo,company,https://finnhub.io/api/news?id=4499b60e1eb77926a7771ede125bf0c897f7b71e64bfb3e9269cea02942494a4,AAPL
AAPL,2026-04-14 14:46:01,"Apple's Fiscal Q2 Earnings Could Beat Street Consensus, BofA Says","Apple's (AAPL) fiscal Q2 earnings could exceed Street estimates on strong iPhone sales, double-digit",Yahoo,company,https://finnhub.io/api/news?id=26354db5619eed21c5b63ab0aea468b1693cb449696a5a9f6921351531159849,AAPL
AAPL,2026-04-14 15:03:00,Globalstar Stock Rises on Amazon Takeover. The Impact on AST SpaceMobile and Iridium.,"Globalstar  stock was jumping on Tuesday as  Amazon.com  is buying the satellite company.  Amazon said it would buy Globalstar for the equivalent of $90 a share.  Globalstar shareholders can elect to sell their shares for cash or receive the online retailer’s stock at a ratio of 0.3210 Amazon shares per Globalstar share, with a value capped at $90.00 per share.",Yahoo,company,https://finnhub.io/api/news?id=983dcc4997f3826df67262fc8230a1435378d83f8988342727d96ca027a51482,AAPL
AAPL,2026-04-14 15:05:00,Bull vs. Bear: Is Apple a Buy or Sell?,Here are the bullish and bearish cases for Apple.,Yahoo,company,https://finnhub.io/api/news?id=bcfa4e5a4b9dcd9303297880534b824272b09fa841c9b643c3db7bcd95f5ca1a,AAPL
AAPL,2026-04-14 15:06:21,Amazon to Acquire Mobile Satellite Services Operator Globalstar,Amazon.com (AMZN) agreed to buy mobile satellite services operator Globalstar (GSAT) as the e-commer,Yahoo,company,https://finnhub.io/api/news?id=b7a3ab29ed9ebcbd612f48a3c373f3921b72e324ddc90cad3094f88cb32e4e8b,AAPL
AAPL,2026-04-14 15:17:37,Apple likely to beat Street estimates on continued strong sales of iPhone: BofA,"Investing.com -- Bank of America expects Apple to deliver an earnings beat for its March quarter, driven by robust iPhone demand and continued strength in its high-margin Services business.",Yahoo,company,https://finnhub.io/api/news?id=b5f9c15b6056393076af96d5c1e58beb55c116c35415464cabe2d30d0b465060,AAPL
AAPL,2026-04-14 15:18:24,Amazon Pays $11.57B for Globalstar to Challenge Starlink,Tech giant buys orbital infrastructure to rival Starlink,Yahoo,company,https://finnhub.io/api/news?id=0831ad784a7f70380e6ad6df70c7ae8a6e7d9eb3d088edd3341271fbae65b313,AAPL
AAPL,2026-04-14 16:22:15,A Deal With Amazon Has This Starlink Rival’s Stock Soaring,"Amazon is buying Globalstar, in a bid to grow its Leo satellite internet service.",Yahoo,company,https://finnhub.io/api/news?id=e9faa80b4a41a2248b6780605b0e56a97ebeacb4b5be6207b4b8830bda6e9252,AAPL
AAPL,2026-04-14 16:37:00,Amazon Declares War on StarLink: $11.5 Billion Globalstar Deal Ignites Space Internet Battle,"The satellite connectivity race has shifted into high gear. Billions of people and devices still sit beyond the reach of traditional cell towers, especially in remote regions, disaster zones, and mobile fleets. Low-Earth orbit constellations now promise always-on coverage, and analysts project the sector could generate around $15 billion in annual revenues by the end ... Amazon Declares War on StarLink: $11.5 Billion Globalstar Deal Ignites Space Internet Battle",Yahoo,company,https://finnhub.io/api/news?id=5c9045db43fbd0dd87fd4326dd7ae38a596b79d825e9d6ca87ee8a13c5a63e46,AAPL
AAPL,2026-04-14 16:40:44,Crypto News: ByBit Is Now Letting Traders Use Bitcoin and Ethereum to Trade Stocks Like Apple and BlackRock’s IBIT,"Most people who hold Bitcoin (CRYPTO: BTC) or Ethereum (CRYPTO: ETH) are doing one of two things with it. They’re either holding and waiting for the price to go up, or trading it for other cryptos—and ByBit just added a third option. The crypto exchange, which serves over 80 million users and ranks among the ... Crypto News: ByBit Is Now Letting Traders Use Bitcoin and Ethereum to Trade Stocks Like Apple and BlackRock’s IBIT",Yahoo,company,https://finnhub.io/api/news?id=fed5868ca6ad3ba3f9b8cbf8ccd3d6c666be8eb135f3002061e051f61541ade0,AAPL
AAPL,2026-04-14 16:46:31,Microsoft Raises Surface Prices Up To $500 Amid Memory Chip Shortage,Price hikes hit Surface Pro and Laptop models as rising memory and component costs pressure hardware pricing across the PC industry.,Yahoo,company,https://finnhub.io/api/news?id=d460acc8beda17136cd0317dc9d65a6e92735bea7fde4b072a5a9e99715af4ad,AAPL
AAPL,2026-04-14 17:01:54,Software Stocks Quietly Sold Off – Snap Up This Undervalued Tech ETF,"The S&P 500 Software Index is down 30%, and it increasingly looks to be on the verge of bottoming out and recovering. The Invesco Nasdaq Internet ETF (NASDAQ:PNQI) might be the perfect buy in this environment, as these stocks are finding their footing and some have already started to make substantial ground towards a full recovery. ... Software Stocks Quietly Sold Off – Snap Up This Undervalued Tech ETF",Yahoo,company,https://finnhub.io/api/news?id=4d7f3b60638bc0dd75489d4638afbcfaabc387fef5b2741cd44e6c214e65a2d7,AAPL
AAPL,2026-04-14 17:18:00,Amazon acquiring Globalstar in $11.57 billion satellite deal,"Amazon Leo gets the spectrum to launch direct-to-device satellite services, while an agreement with Apple ensures iPhone satellite features continue",Yahoo,company,https://finnhub.io/api/news?id=4650007e58e67cacf3fe04797c46efbd33ad24722e8ea563c217df09ab4590d9,AAPL
AAPL,2026-04-14 17:20:50,"Nike Shares Move Higher As Tim Cook, Elliott Hill Buy More Stock",Nike Inc (NYSE:NKE) shares are rising in after-hours on Tuesday amid continued insider buying. Here&#39;s what you need to know.,Benzinga,company,https://finnhub.io/api/news?id=f861f99e12b5d08bd2e1b2723ae02cbe17355e4ae53ac2ac617340e629d40252,AAPL
AAPL,2026-04-14 17:30:00,How Starkey is staying ahead of the AI hearing-aid wave,Starkey CEO and president Brandon Sawalich joins Market Catalysts to discuss how his company revolutionized the hearing aid market with AI.,Yahoo,company,https://finnhub.io/api/news?id=a87d10b6975673818ba2fb82a003b05fa63a7ab66b35a75fbac9e2082b67f4b5,AAPL
AAPL,2026-04-14 17:56:49,Why This 97-Year-Old Fund Pays 8% Without Sacrificing Safety,"Adams Diversified Equity Fund (NYSE:ADX) has distributed income to shareholders since 1929, making it one of the oldest closed-end funds in the United States. Its yield of roughly 8% attracts income investors, but understanding whether that payout is safe requires understanding how it actually works. A Yield Built on Two Engines, Not One ADX generates ... Why This 97-Year-Old Fund Pays 8% Without Sacrificing Safety",Yahoo,company,https://finnhub.io/api/news?id=22fdf1ecb1cb2a0c039dbed69014f6ba5c9c31c537003889ce542f6b63cf34f3,AAPL
AAPL,2026-04-14 18:06:13,"Amazon Rises 5%, Globalstar Jumps 10% as $11.57 Billion Acquisition Ignites a Satellite War With SpaceX","Amazon (NASDAQ:AMZN) stock is up 5% today, rising from $239.89 to $252, after the company announced a blockbuster $11.57 billion acquisition of Globalstar (NASDAQ:GSAT). The deal is designed to turbocharge Amazon’s Project Kuiper satellite broadband initiative and put it in direct competition with SpaceX’s Starlink. So, let’s break down what’s moving these stocks and why ... Amazon Rises 5%, Globalstar Jumps 10% as $11.57 Billion Acquisition Ignites a Satellite War With SpaceX",Yahoo,company,https://finnhub.io/api/news?id=9ec3bda873f288c4d43100dc9a03f6cc1b39bd845c9c7ef7f57ca1683bfd6ebe,AAPL
