symbol,datetime,headline,summary,source,category,url,related
AAPL,2026-04-14 18:14:31,"Jim Cramer Says “Don’t Mess With Alphabet, They’re Crushing It”","Alphabet Inc. (NASDAQ:GOOGL) is among Jim Cramer’s recent stock calls as he urged investors to stand by the defense sector. A club member asked whether their portfolio is diverse enough if their top 5 holdings are GOOGL, AAPL, MDT, MPLX, and RTX. In response, Cramer said: Okay, I’m liking what I see here. One of […]",Yahoo,company,https://finnhub.io/api/news?id=b0f5ac3fbf222f111270b6be8e468beb876dd4ff0b6c50050a440b260dcf1a76,AAPL
AAPL,2026-04-14 19:09:00,Apple and Amazon Partner on Satellite Deal. Why It Makes Sense.,Amazon.com and Apple’s latest partnership showcases each company’s individual strengths—and puts them both in better competitive positions.,Yahoo,company,https://finnhub.io/api/news?id=a2f72c5ead0f579743dc2b43220ac6e50aa7e2c7e36368d12c1723c69936f60f,AAPL
AAPL,2026-04-14 19:18:51,Why Amazon Stock Just Popped,Investors love the idea of Amazon powering Apple's DTC iPhones.,Yahoo,company,https://finnhub.io/api/news?id=6fa5407d4c92b1896d86f50465b65ec5e6cc6dc398c6b35984fd5bbc285184c7,AAPL
AAPL,2026-04-14 19:26:20,Amazon Stock Pops on Double Satellite Win,"Amazon Agrees to Buy Globalstar, Expands Apple Satellite Tie-Up",Yahoo,company,https://finnhub.io/api/news?id=d304da2e6cc546d4f3ef90fbe3009aec97e2cb5babddff8c6f320a41fb6fdfea,AAPL
AAPL,2026-04-14 19:36:45,"Dow Jones E-Commerce Giant Amazon, Alphabet Eye New Buy Points",Dow Jones retail giant Amazon and Alphabet are approaching new buy points as the stock market continues to rally.,Yahoo,company,https://finnhub.io/api/news?id=73042079f0a85a4acc6af5affca3be369a45c641bf587053c7e09b261e1322a2,AAPL
AAPL,2026-04-14 19:45:34,Coinbase Reportedly Courts Anthropic to Bolster Exchange Security Infrastructure,Coinbase reportedly pursues Anthropic's Mythos AI model access to bolster exchange security as Project Glasswing reshapes cyber defense.,Yahoo,company,https://finnhub.io/api/news?id=8800c1c52a566d8d199394cdc4fc8be47e208ff324f4d7444b5f912721b4e968,AAPL
AAPL,2026-04-14 20:00:22,OpenAI Releases Cyber Model to Limited Group in Race With Mythos,"(Bloomberg) -- OpenAI is letting a select group of users access a new artificial intelligence model that’s meant to be more adept at spotting software security vulnerabilities, one week after rival Anthropic PBC announced a limited release of an AI tool called Mythos. The ChatGPT maker said Tuesday that it’s beginning to roll out GPT-5.4-Cyber, which is aimed at finding issues in software so organizations can fix them. GPT-5.4-Cyber also places fewer constraints on the ways users can probe the m",Yahoo,company,https://finnhub.io/api/news?id=1b37484111c0640e2d6ccaaf867cf77414b5c179695302607f7c9741621df8f6,AAPL
AAPL,2026-04-14 21:05:49,Amazon Buys Globalstar for $11.6 Billion to Take On Starlink,"The Bezos-Musk space war just got a new front, and Apple might want to start paying attention",Yahoo,company,https://finnhub.io/api/news?id=c4537422b90eae7a99fc48b76f6f8fa136dc86066aef54c2dc1a1e0a3aac6096,AAPL
AAPL,2026-04-14 21:10:05,Nike shares rise 2% as Apple’s Tim Cook and CEO Elliott Hill increase stakes,Investing.com -- Nike Inc. (NYSE:NKE) shares rose 2% in after-hours trading Tuesday following insider purchases by director and Apple CEO Tim Cook and company CEO Elliott Hill.,Yahoo,company,https://finnhub.io/api/news?id=4251832418819be8b02ec19ab85356904045c66980e0f8a5cacfb0cc8c1e79e7,AAPL
AAPL,2026-04-14 21:21:48,CNBC Daily Open: S&P 500 nears all-time high ,"Markets are rising on Iran-U.S. talks, but there remains massive disagreements over the Strait of Hormuz. ",CNBC,company,https://finnhub.io/api/news?id=0ff60ce8849b0ae772b7c3ca104f983e243577aab39b3489e18ef7d09121600c,AAPL
AAPL,2026-04-14 21:29:00,"Liberty All-Star® Growth Fund, Inc. March 2026 Monthly Update","BOSTON, April 14, 2026--Liberty All-Star® Growth Fund, Inc. March 2026 Monthly Update",Yahoo,company,https://finnhub.io/api/news?id=c14eaea34eb85296209b41978d1343f30bd6a0d0f024fea0433258d95c384a6d,AAPL
AAPL,2026-04-14 22:05:39,Amazon-Globalstar Deal Is Poised to Boost Apple’s Satellite Ambitions,"(Bloomberg) -- Amazon.com Inc.’s takeover of Globalstar Inc. is poised to benefit one of the company’s biggest rivals in hardware devices: Apple Inc.The $11.6 billion deal, announced Tuesday, will provide Amazon with a network of satellites — jump-starting a push to offer internet service directly to devices. The online retailer also pledged to start supporting Apple’s emergency messaging service with its Leo satellite system, filling a role currently held by Globalstar. If the deal goes through",Yahoo,company,https://finnhub.io/api/news?id=d87d551bbe1530907f9265c429c4bfb6806cb1e946214bbc5a7942101e9d7519,AAPL
AAPL,2026-04-14 22:37:00,Nike Stock Jumps. Its CEO and Apple’s Tim Cook Bought $2M Worth of Shares.,"Cook is Nike’s lead independent director and has been on the company board since 2005.  Cook bought $3 million worth of shares in Nike at the end of December.  After the purchase, Cook holds 130,480 Nike shares, worth about $5.7 million based on Tuesday’s closing price.",Yahoo,company,https://finnhub.io/api/news?id=627f72a1489d2f793ad656908a367edaac88990cfe2233237bb0dd62b987d301,AAPL
AAPL,2026-04-14 23:06:51,Nike Shares Get a Lift After Tim Cook and Elliott Hill Buy More Stock,"Apple Chief Executive Tim Cook and Nike CEO Elliott Hill just gave Nike’s stock another boost.  The sneaker company's stock price rose 2% in after-hours trading after Hill and Cook, the lead director on Nike’s board, disclosed they had bought nearly 50,000 shares in Nike between them.  Cook and Hill's purchases provided a jolt of support for Nike, whose turnaround has hit snags--especially in China.",Yahoo,company,https://finnhub.io/api/news?id=5943b53054329cb778c4507f1561f5520fe2968f41907afc7e60728e6888d661,AAPL
AAPL,2026-04-14 23:15:00,Monthly Newsletter - March 2026,"A risk that it is out of the normal course of events, is unexpected, unanticipated and is extremely hard to guard against, is exogenous.",SeekingAlpha,company,https://finnhub.io/api/news?id=d76f3c3a79c36de9ef2c61fcffea386100664d7dc52ced0308a0d936dec98b77,AAPL
AAPL,2026-04-14 23:37:00,MAGS ETF faces its ultimate millionaire test,"Seven stocks have dominated the U.S. market for the better part of three years, and one ETF lets you own all of them. The Roundhill Magnificent Seven ETF (MAGS) holds Apple, Microsoft, Amazon, Alphabet, Nvidia, Meta Platforms, and Tesla in a single fund. Since launching in April 2023, it has ...",Yahoo,company,https://finnhub.io/api/news?id=524a84f11b236ebb3b12a58db9e9e5ad059d5a7c027ad0d402bdf1f2092781a4,AAPL
AAPL,2026-04-15 00:17:00,Apple CEO Tim Cook Just Bought Nike Stock. His Last Purchase Didn’t Go So Well.,"Cook is Nike’s lead independent director and has been on the company board since 2005.  Cook bought $3 million worth of shares in Nike at the end of December.  After the purchase, Cook holds 130,480 Nike shares, worth about $5.7 million based on Tuesday’s closing price.",Yahoo,company,https://finnhub.io/api/news?id=6a5bf9127aa50070ad30da4bb604543d439796222c4079ee015772608d4760ce,AAPL
AAPL,2026-04-15 00:30:00,Why Amazon Is Buying Globalstar—and What It Means for Other Satellite Companies,"Globalstar  stock jumped on Tuesday after  Amazon.com  agreed to buy the satellite company, in a move that could have big implications for the wider space sector.  Amazon said it would buy Globalstar for the equivalent of $90 a share.  Globalstar shareholders can elect to sell their shares for cash or receive the online retailer’s stock at a ratio of 0.3210 Amazon shares per Globalstar share, with a value capped at $90.00 per share.",Yahoo,company,https://finnhub.io/api/news?id=001df3c56654e108c98f6f26517b3c66c73e295daa6218e8b862ea7ce56425d2,AAPL
AAPL,2026-04-15 00:36:26,FCC Chair Brendan Carr Gives Nod To Amazon-Globalstar Deal As Satellite Internet Race With Elon Musk-Led SpaceX Intensifies: 'We're Very Open-Minded…',"FCC Chair Brendan Carr approves of Amazon&#39;s acquisition of Globalstar, citing importance of competition in space-based internet sector.",Benzinga,company,https://finnhub.io/api/news?id=df93313d90b0374e2933ca9b699c7c39e69b1f94a65be1a9c8337f1a6ca58a49,AAPL
AAPL,2026-04-15 01:10:52,Amazon’s $11.6 Billion Globalstar Deal Amps Up Musk Rivalry,"(Bloomberg) -- Amazon.com Inc.’s $11.6 billion deal to buy Globalstar Inc. ramps up competition with Elon Musk’s Starlink in satellite communications, a market predicted to double to $200 billion in the coming years.On Tuesday, Amazon announced plans to buy the satellite operator for a mix of stock and up to $90 a share and said that in 2028 it will launch a direct-to-device service, offering connectivity straight to people’s mobile devices as an alternative to traditional cell towers.Through Gl",Yahoo,company,https://finnhub.io/api/news?id=7fd6dae5f48eeb081ff92590e7d3ccb0052bf53ac590069a01b2a95b72c8ca8e,AAPL
AAPL,2026-04-15 01:43:58,CNBC Daily Open: Back-to-back gains on Iran peace talks hope,Global stocks rally in back-to-back gains on optimism of renewed peace talks between the U.S. and Iran. ,CNBC,company,https://finnhub.io/api/news?id=57613e9127c96430dcb5804d49b29fb3b1ba3614dae894e39737a452bd710722,AAPL
AAPL,2026-04-15 01:49:01,Artemis II astronauts made most of professional photography training,The two professionalphotography instructors who trained Artemis II astronauts totake pictures of the moon and Earth during their historic lunarflyby said they were as impressed as the public by the...,Finnhub,company,https://finnhub.io/api/news?id=ab02e5901cd6d98105b1b31e7c46087483c39154129dd5db589c9ad900b647ab,AAPL
AAPL,2026-04-15 02:00:00,The Bezos Vs. Musk Space Race Is Heating Up,"Bezos-founded companies are pushing ahead in satellite connections and rocket launches, businesses that Musk’s SpaceX has long dominated.",Yahoo,company,https://finnhub.io/api/news?id=59a6f046ffe87e7a239b21af486111a89f3968239a906462461623a22ba4b568,AAPL
AAPL,2026-04-15 02:07:33,Apple Lawsuit Puts Apple Pay Controls And Services Valuation In Focus,"Apple has been named as a defendant in a wide reaching lawsuit alleging failure to prevent high frequency gambling transactions processed via Apple Pay. The case centers on claims that Apple, alongside other financial and e commerce firms, enabled hundreds of rapid gambling payments tied to an allegedly fraudulent gaming operator. Plaintiffs are seeking substantial damages and injunctive relief, raising questions about Apple Pay’s consumer protection controls and regulatory compliance. For...",Yahoo,company,https://finnhub.io/api/news?id=ef1be8adf260460e75b8cb725f530bf4e37a00529e3cc9a53ab0fb83c1765132,AAPL
AAPL,2026-04-15 03:02:54,"Korean AI chip startup DEEPX, Hyundai work on robots powered by generative AI","South Korean AI chip startup DEEPX will expand its partnership with Hyundai Motor Group to develop a computing platform for generative ‌AI robots using its second generation of low-power chips, its top executive said, as ‌it gets set for an IPO.  DEEPX is in talks with the government and investors to raise more than 600 ​billion won ($408 million) in an ongoing funding round, in the run-up to a potential IPO in South Korea, DEEPX CEO Lokwon Kim said.  The company, which began producing chips late last year, is one of a number of South Korean startups riding on Seoul's ambitions to nurture artificial intelligence champions and ‌make the country an AI leader.",Yahoo,company,https://finnhub.io/api/news?id=f46a59a3dd649a57dd30ae274df5ba38e1469a35cf57d470f27a33a60e95b954,AAPL
AAPL,2026-04-15 05:09:44,ASML lifts 2026 outlook on the back of stronger AI demand,ASML (ASML) raised its 2026 revenue outlook on Wednesday as ‌demand for artificial intelligence chipmaking ‌tools continues to rise,Yahoo,company,https://finnhub.io/api/news?id=3741b303c09455fbf9950723e6afe95d3c0e07e11d31d68cb7a1ade0748e898b,AAPL
AAPL,2026-04-15 05:45:27,"Rising Memory Costs Trigger Apple, Samsung's Premium Power Play",Foldable OLEDs to grow 34% in 2026 as Apple joins the market. Counterpoint analyzes how memory inflation is reshaping the smartphone sector.,Benzinga,company,https://finnhub.io/api/news?id=f5c4aa27c8aea7e766417451381b06236faf3bbecef88d51264eb200c6e00ca1,AAPL
AAPL,2026-04-15 06:29:57,Amazon's $11.6 Billion Globalstar Buy Is 'Strategic Positive' For Satellite Dominance,"BNP Paribas analyst Nick Jones labels Amazon&#39;s (AMZN) $11.6B Globalstar acquisition a strategic win, accelerating the Amazon Leo satellite network and securing a key Apple partnership.",Benzinga,company,https://finnhub.io/api/news?id=2cba1ead7257f3ed6e07edcb50723ec688b86b27c96f4ab0c8dae0749aff37d0,AAPL
AAPL,2026-04-15 06:32:00,PlanHub Appoints David Fleischman as Chief Product Officer,"PlanHub, the leading preconstruction bidding platform and marketplace connecting general contractors, subcontractors, and suppliers across the commercial construction industry, today announced the appointment of David Fleischman as Chief Product Officer (CPO). In his role, Fleischman will lead PlanHub's product strategy and roadmap, with a sharp focus on delivering best-in-class AI-powered products that put customers at the center of every decision.",Yahoo,company,https://finnhub.io/api/news?id=eeffa3dae6bc11c2a7f2e21432a9464781a1c4b74d0c7561d1d2d33964cfcb11,AAPL
AAPL,2026-04-15 09:54:12,"Apple: More Attention On AI Strategy, Less On iPhone Ahead Of Q2","Apple's iPhone and Services expected to be solid, but AI strategy concerns linger. Click here to read my earnings preview of AAPL stock.",SeekingAlpha,company,https://finnhub.io/api/news?id=74ac7b84b074ca53ce409a7169149e5404a9182a46017fa4f7e2a3c6c77aac2d,AAPL
AAPL,2026-04-15 10:08:00,"These Stocks Are Today’s Movers: Broadcom, Nike, ASML, Bank of America, Morgan Stanley, GitLab, and More",Broadcom stock rises after the chip maker extends an existing deal with Facebook parent Meta Platforms.,Yahoo,company,https://finnhub.io/api/news?id=0eef6f4cae298f2145f3b6f96a1db64672f337c8af05985fbf55ed19b7fa4e50,AAPL
AAPL,2026-04-15 10:41:38,VOO vs. QQQ vs. SPY — Which ETF Is the Best Buy Right Now?,"When it comes to investing in the broader U.S. market, ETFs like Vanguard S&P 500 ETF (VOO) from Vanguard, the SPDR S&P 500 ETF Trust (SPY) from State Street, and Invesco QQQ Trust (QQQ) from Invesco PowerShares are among the most popular choices. Using the TipRanks’ ETF Comparison Tool, we have compared VOO, SPY, and QQQ to determine the best ETF for investors in 2026. VOO or SPY or QQQ: Key Differences While VOO and SPY both track the S&P 500 (SPX), QQQ follows the Nasdaq-100 (NDX), giving it",Yahoo,company,https://finnhub.io/api/news?id=0eab6ace0e424c6e7abc634b5badd7e6c0def1f88ab649c90dedf954c70bceb7,AAPL
AAPL,2026-04-15 10:48:07,Top BofA Analyst Raises Apple Stock (AAPL) Price Target Ahead of Q2 Earnings,"Apple (AAPL) stock is down about 5% year-to-date due to concerns about higher input costs, tariffs, and the impact of macro uncertainty on consumer spending. Nonetheless, ahead of Apple’s Q2 FY26 earnings, AAPL bulls are optimistic about the stock, citing several positives, including a loyal iPhone customer base and innovative offerings like the new MacBook Neo. On Tuesday, top Bank of America analyst Wamsi Mohan reiterated a Buy rating on AAPL stock and raised his price target to $325 from $320",Yahoo,company,https://finnhub.io/api/news?id=47f695c9d4859c5e63576301bca38dc1ab28e967d30a6d46a676aa2f32d2f379,AAPL
AAPL,2026-04-15 11:06:56,Microsoft: Mispriced And Unfairly Tarnished With Overblown Capital Allocation Fears (Rating Upgrade),Microsoft (MSFT) looks oversold despite Q2 cash flow worries.,SeekingAlpha,company,https://finnhub.io/api/news?id=de865012afa8c03699fd96e9e098967eacf875962e594459d23af10d17ff30f1,AAPL
AAPL,2026-04-15 11:17:00,"Metaverse in Entertainment Market Report 2026: Revenues to Grow from $35 Billion to Over $89 Billion by 2030, Led by Apple, Samsung Electronics, and ByteDance","The market presents opportunities in virtual events, gaming, and social platforms, driven by increased VR adoption, AI personalization, and digital assets Metaverse in Entertainment Market Metaverse in Entertainment Market Dublin, April 15, 2026 (GLOBE NEWSWIRE) -- The ""Metaverse in Entertainment Market Report 2026"" has been added to ResearchAndMarkets.com's offering. The metaverse in the entertainment market has experienced significant growth and shows promising prospects for future expansion.",Yahoo,company,https://finnhub.io/api/news?id=e700ce17cbdaa808adf3a3cee7c9103a5223b706db278264e9f34f9ec5d1ccb1,AAPL
AAPL,2026-04-15 11:35:42,"Apple (AAPL) Stock at $260: Buy, Sell or Hold?","Apple (NASDAQ:AAPL) is a Hold at around $260 per share. The stock sits in a frustrating middle ground: fundamentals are excellent, but valuation leaves limited margin for error and near-term headwinds are real. Apple designs and sells consumer electronics, software and digital services across a global installed base of more than 2.5 billion active devices. ... Apple (AAPL) Stock at $260: Buy, Sell or Hold?",Yahoo,company,https://finnhub.io/api/news?id=560b84e75e0eab6047e92578a246b91d51a01c5b64a39d8c0685272620164a6d,AAPL
AAPL,2026-04-15 11:45:02,Amazon Stock Is Overbought Amid Globalstar Deal. Is a Pullback Coming?,Amazon stock rallied on Tuesday after announcing Globalstar acquisition. Goldman Sachs explains why AMZN shares are worth buying despite an overbought RSI.,Yahoo,company,https://finnhub.io/api/news?id=3d4522b0d9dbc8353b919dc071ce7664d8652320e6f3271008bd7041290cddb9,AAPL
AAPL,2026-04-15 11:50:01,What's Behind The Jump In Nike Stock?,"Shares of Nike, Inc. (NASDAQ: NKE) are trading higher Wednesday after SEC filings revealed that Apple Inc (NASDAQ:AAPL) CEO Tim Cook and Nike CEO Elliott Hill purchased Nike stock.",Benzinga,company,https://finnhub.io/api/news?id=07bc390d7a871a0b79ab40fcbf582f83ead841857f16aafe7fd670742a89bb0c,AAPL
AAPL,2026-04-15 12:04:35,Apple: Inventory Does Not Lie,,SeekingAlpha,company,https://finnhub.io/api/news?id=7f5abb4c5c409a87ca1b40f08def60bcce7bc374d7a5ca91d7474ea82b2255c0,AAPL
AAPL,2026-04-15 12:08:50,Bezos Just Bought What Musk Wanted — And The $200B Space War Is Escalating,"Amazon&#39;s Globalstar deal may edge out SpaceX, heating up the $200B low-Earth orbit satellite race and intensifying the Bezos–Musk rivalry.",Benzinga,company,https://finnhub.io/api/news?id=6b68af8c5cae0050705a17c41f83f5a2d79711f4069871c75042410f1b4f26b4,AAPL
AAPL,2026-04-15 12:34:15,Tim Cook and Nike CEO Drop $2.1 Million on Shares — Bold Bet or Wishful Thinking?,"Consumer discretionary stocks have taken a beating lately as tariff worries and uneven demand cloud the outlook for apparel and footwear giants. With China slowing and new trade costs biting into margins across the sector, retail investors have grown cautious about names that once seemed unstoppable. Nike (NYSE:NKE) stands out as a prime example. The ... Tim Cook and Nike CEO Drop $2.1 Million on Shares — Bold Bet or Wishful Thinking?",Yahoo,company,https://finnhub.io/api/news?id=fb165192d2d6ad36aed526465490d15044320f872f426b104457343b01c4d59b,AAPL
AAPL,2026-04-15 12:57:45,Nvidia Rival Flashes Telltale Clues As Breakout Nears,"While flashing telltale signs of rising strength, Nvidia AI rival Broadcom stock looks to etch a breakout.",Yahoo,company,https://finnhub.io/api/news?id=f03126f2e89b33df670077ec39f9d232298014ad05662f1eeda6c7afbe612a7c,AAPL
AAPL,2026-04-15 13:04:28,Taiwan Semiconductor Manufacturing Q1 Preview: What Could 12th Straight Double Beat Mean With Shares Near All-Time Highs?,"Taiwan Semiconductor Manufacturing reports Q1 results Thursday, a key report for investors to watch with major impacts on chip, AI and technology stocks.",Benzinga,company,https://finnhub.io/api/news?id=8d434d721188bea8ff87050fc2f04fc2b0d67a67656755e6001e9a76efdf46bf,AAPL
AAPL,2026-04-15 13:04:34,Avoid The Classic Investor Mistake As Trump Says Iran War Is 'Close to Over',"



Ahead Of The Curve


",Benzinga,company,https://finnhub.io/api/news?id=26c6e2c86df816b96ed65aac9809c6d41a546d1f97e09d673601d19a962a697c,AAPL
AAPL,2026-04-15 13:06:48,Is Taiwan Semiconductor (TSM) The Best AI Stock to Buy Now According to Brad Gerstner?,"We just covered the 10 Best Stocks to Buy According to AI Bull Brad Gerstner. Taiwan Semiconductor Manufacturing (NYSE:TSM) ranks #7 (see the 5 Best Stocks to Buy According to AI Bull Brad Gerstner). Altimeter Capital’s Stake: $370,510,893 Rising demand for chips and tight capacity give Taiwan Semiconductor Manufacturing (NYSE:TSM) a unique position to have […]",Yahoo,company,https://finnhub.io/api/news?id=b414d7bf7de3e87290a0eb5f3ebac7c47ea0116aa7c9f7ed456fc27668dcc023,AAPL
AAPL,2026-04-15 13:08:00,Amazon Just Made a Big Space Play. Should Elon Musk Be Nervous?,The tech giant is buying a little-known satellite company that could help turn phones into lifelines far beyond the reach of cell towers.,Yahoo,company,https://finnhub.io/api/news?id=368435b5b84eb8e591125c547271e53067af55f6a33414ea8b7e2fcfd1d005a9,AAPL
AAPL,2026-04-15 13:35:48,10 Information Technology Stocks Whale Activity In Today's Session, ,Benzinga,company,https://finnhub.io/api/news?id=5de2af179adf8e668c7ab7941cab26202ac0c5198911c4ee659afca2efd111c2,AAPL
AAPL,2026-04-15 14:07:15,Jim Cramer Says ‘It Just Didn’t Happen’ — and That’s Why Many Americans Missed the Most Powerful Rally of 2026,"On the April 14 episode of Mad Money, Jim Cramer delivered a sharp diagnosis of why so many investors missed one of the strongest market moves of the year: The catastrophes they feared never arrived. “It just didn’t happen,” Cramer said the session’s gains reflected a collapse of fear rather than a surge of new ... Jim Cramer Says ‘It Just Didn’t Happen’ — and That’s Why Many Americans Missed the Most Powerful Rally of 2026",Yahoo,company,https://finnhub.io/api/news?id=e99a0df2d73f54ab0e1b97661ba2b61ede5470ab826de5a2468a7fa821e57a0c,AAPL
AAPL,2026-04-15 14:11:19,"Why AST SpaceMobile Could Buy Iridium, Viasat Spectrum To Counter Amazon's Globalstar Deal","AST SpaceMobile could fire back at Amazon's proposed acquisition of Globalstar by targeting Viasat or Iridium spectrum assets, analysts say.",Yahoo,company,https://finnhub.io/api/news?id=712643bedbf1e7a03e3353b274bce6c7f09b6edb0614d9be793f5f7b1e5ccb21,AAPL
AAPL,2026-04-15 14:19:52,Amazon Vs. SpaceX Space Race Heats Up At Difficult Time For Musk's Upcoming IPO,"Amazon outbid SpaceX for Globalstar in an $11.57 billion deal as Bezos closes the gap on Musk across satellites, rockets, and lunar missions ahead of SpaceX&#39;s IPO.",Benzinga,company,https://finnhub.io/api/news?id=196455c0c215ba9f70dec414f77ffca00d5dcd1fbb21a32bf19ee92dde9f1250,AAPL
AAPL,2026-04-15 14:45:00,Apple CEO Tim Cook Buys Nike Stock. His Last Purchase Didn’t Go So Well.,"While Wall Street has been sprinting away from  Nike  stock this year, recent purchases by  Apple  CEO Tim Cook and the apparel maker’s chief executive signal some insiders are betting on a comeback.  Cook purchased 25,000 Nike shares on Friday for roughly $42.43 each, according to a filing with the Securities and Exchange Commission, for a total of $1.06 million.  The Apple CEO serves as Nike’s lead independent director and has sat on the board for more than a decade.",Yahoo,company,https://finnhub.io/api/news?id=f320495bef04cf6cefee051b50fb87721fc42d692841083e8851ead5e029a617,AAPL
AAPL,2026-04-15 14:46:49,"Tim Cook buys 25,000 shares of Nike stock","The Apple CEO is also a Nike board member. And he just spent more than $1 million of his own money on the stock near its 52-week low. Cook purchased 25,000 shares of Nike Class B Common Stock on April 10 at a weighted average price of $42.43 per share, according to a Form 4 filing with the ...",Yahoo,company,https://finnhub.io/api/news?id=fbdb660ea7e62886f7efa7bc29f519ee38d54c5d8a006474ff18eb1467a25ebe,AAPL
AAPL,2026-04-15 14:52:54,Nike Shares Rise as CEO Elliott Hill and Apple’s Tim Cook Buy More Stock,"The combined purchases totaled 52,660 shares or roughly $2.3 million.",Yahoo,company,https://finnhub.io/api/news?id=0b05f45e2516ce909a7be4f3740c3f68f0b213b955c9c066172f005d5160add9,AAPL
AAPL,2026-04-15 15:05:37,Assessing Apple (AAPL) Valuation As Tariffs And Production Shifts Reshape Profit Outlook,"Apple stock overview Apple (AAPL) is back in focus for investors as its recent share performance and latest financial figures invite a closer look at how the US$2,589.3b company is currently being valued in the market. See our latest analysis for Apple. At a share price of US$258.83, Apple’s recent gains have been modest. However, the 1 year total shareholder return of 33.81% and 5 year total shareholder return of 99.06% point to stronger longer term momentum. If you are thinking beyond mega...",Yahoo,company,https://finnhub.io/api/news?id=2137c191db8b6fbd53cc525e9f4ef473433ed76cff7aec455afbeb6f0955d8ed,AAPL
AAPL,2026-04-15 15:08:25,Activest Bets Big on Asia With $5.8 Million AAXJ Purchase,"This ETF tracks a broad basket of Asian equities outside of Japan, combining exposure to both emerging and developed markets.",Yahoo,company,https://finnhub.io/api/news?id=cfc352d5e1d0d0f04fb4ea750d9f4e62f74996bdb379383c44cdae12913935fe,AAPL
AAPL,2026-04-15 15:11:13,Cyndeo Wealth Partners Increases Position in First Trust Global Tactical Commodity Strategy Fund,"The First Trust Global Tactical Commodity Strategy Fund (FTGC) invests through actively managed commodity futures, where returns can differ from both spot prices and traditional income strategies. Its elevated distributions can stand out to investors, reflecting how its strategy is positioned across changing commodity markets.",Yahoo,company,https://finnhub.io/api/news?id=d1f32b97587a81a484b80bb575561245600f78bfce36449cda12532386750038,AAPL
